{
  "schema_version": "1.0.0",
  "corpus_version": "five-dossier-1.0.0",
  "project": {
    "id": "C09",
    "title": "CONSTRUCTION OF OLOKORO-AHIAUKWU-AMANGWO-UMUAJATA-NGWA ROAD C/NO. 6063",
    "anchor_record_id": "budget-row"
  },
  "sources": [
    {
      "id": "appropriation-2019",
      "institution": "Federal appropriation schedule / National Assembly",
      "custodian": "Ministry of Solid Minerals Development government host",
      "source_class": "appropriation",
      "title": "Official-government-hosted 2019 appropriation schedule",
      "url": "https://msmd.gov.ng/wp-content/uploads/2023/03/2019-Appropriation.pdf",
      "retrieved_at": "2026-09-17T08:51:55.199524+00:00",
      "sha256": "032b0c1e1a0b602ca97eb6eede11ee5ccd93fcb5f56bb5c2010012ae526c6451",
      "original_filename": "2019-Appropriation.pdf",
      "format": "PDF",
      "document_created_at": "2019-05-09T11:32:37+01:00",
      "historical": true,
      "observation_date": null,
      "limitations": [
        "Table labelled 2019 APPROPRIATION ACT; running header/footer labelled 2019 APPROPRIATION BILL; official ministry-hosted schedule, not a separately authenticated signed enactment.",
        "Annual provision is not payment, release or total contract cost."
      ],
      "publication": {
        "disposition": "APPROVED_FACTUAL_SUBSET",
        "authority": "CivicProof Controller, content review authorized by Operator Gate 7",
        "reference": "publication/register.json; docs/PUBLICATION_REGISTER.md"
      },
      "review": {
        "status": "VALIDATED",
        "reviewer": "Independent Gate 5 corpus-admission agent",
        "reference": "docs/evaluation/GATE_5_SOURCE_REVIEW.md",
        "reviewed_on": "2026-09-17",
        "content_sha256": "249ea00ab2e9ffdad7472889639cf36bc6bffdb261b4a9b9e5d22fa10f8e9d07",
        "method": "Preserved-original SHA-256 check; fresh PDF extraction plus visual table review, or exact parsed JSONL original-line comparison; field-level transcription."
      }
    },
    {
      "id": "works-southeast",
      "institution": "Federal Ministry of Power, Works and Housing (Works), South-East Unit",
      "custodian": "Federal Ministry of Works",
      "source_class": "official_implementation",
      "title": "Historical Works South-East highways report",
      "url": "https://fmw.gov.ng/themes/front_end_themes_01/images/uploads_images/1562349980.pdf",
      "retrieved_at": "2026-09-17T08:52:52.803387+00:00",
      "sha256": "17f8e177061f36426859f6ed45faefd4af06d077b9d678271baf10d6aade7364",
      "original_filename": "1562349980.pdf",
      "format": "PDF",
      "document_created_at": "2019-07-05T00:57:28+01:00",
      "historical": true,
      "observation_date": null,
      "limitations": [
        "Metadata is a file timestamp, not a verified observation date. Not evidence of 2026 condition.",
        "Amount certified to date is not independently verified treasury payment."
      ],
      "publication": {
        "disposition": "APPROVED_FACTUAL_SUBSET",
        "authority": "CivicProof Controller, content review authorized by Operator Gate 7",
        "reference": "publication/register.json; docs/PUBLICATION_REGISTER.md"
      },
      "review": {
        "status": "VALIDATED",
        "reviewer": "Independent Gate 5 corpus-admission agent",
        "reference": "docs/evaluation/GATE_5_SOURCE_REVIEW.md",
        "reviewed_on": "2026-09-17",
        "content_sha256": "9027969d259c94673b5f78a7dce98af5f2788247f90206afa986cece60e519f2",
        "method": "Preserved-original SHA-256 check; fresh PDF extraction plus visual table review, or exact parsed JSONL original-line comparison; field-level transcription."
      }
    }
  ],
  "records": [
    {
      "id": "budget-row",
      "source_id": "appropriation-2019",
      "document_sha256": "032b0c1e1a0b602ca97eb6eede11ee5ccd93fcb5f56bb5c2010012ae526c6451",
      "locator": {
        "page": 664,
        "row": "ERGP12131115"
      },
      "observations": [
        {
          "id": "budget.code",
          "kind": "project_code",
          "raw_value": "ERGP12131115",
          "value": "ERGP12131115",
          "currency": null,
          "fiscal_year": null,
          "source_field": "CODE",
          "normalization": "identity",
          "observation_date": null,
          "missing_date_reason": "The source does not establish an observation date for this field; publication, award and milestone dates have separate meanings."
        },
        {
          "id": "budget.route",
          "kind": "route",
          "raw_value": "CONSTRUCTION OF OLOKORO-AHIAUKWU-AMANGWO-UMUAJATA-NGWA ROAD C/NO. 6063",
          "value": "CONSTRUCTION OF OLOKORO-AHIAUKWU-AMANGWO-UMUAJATA-NGWA ROAD C/NO. 6063",
          "currency": null,
          "fiscal_year": null,
          "source_field": "LINE ITEM",
          "normalization": "identity",
          "observation_date": null,
          "missing_date_reason": "The source does not establish an observation date for this field; publication, award and milestone dates have separate meanings."
        },
        {
          "id": "budget.contract",
          "kind": "contract_number",
          "raw_value": "6063",
          "value": "6063",
          "currency": null,
          "fiscal_year": null,
          "source_field": "LINE ITEM / C/NO.",
          "normalization": "identity",
          "observation_date": null,
          "missing_date_reason": "The source does not establish an observation date for this field; publication, award and milestone dates have separate meanings."
        },
        {
          "id": "budget.agency",
          "kind": "agency",
          "raw_value": "FEDERAL MINISTRY OF POWER WORKS & HOUSING - HQTRS",
          "value": "FEDERAL MINISTRY OF POWER WORKS & HOUSING - HQTRS",
          "currency": null,
          "fiscal_year": null,
          "source_field": "MDA",
          "normalization": "identity",
          "observation_date": null,
          "missing_date_reason": "The source does not establish an observation date for this field; publication, award and milestone dates have separate meanings."
        },
        {
          "id": "budget.annual",
          "kind": "annual_appropriation",
          "raw_value": "204,205,050",
          "value": "204205050",
          "currency": "NGN",
          "fiscal_year": 2019,
          "source_field": "AMOUNT",
          "normalization": "grouped_decimal",
          "observation_date": null,
          "missing_date_reason": "The source does not establish an observation date for this field; publication, award and milestone dates have separate meanings."
        }
      ],
      "publication": {
        "disposition": "APPROVED_FACTUAL_SUBSET",
        "authority": "CivicProof Controller, content review authorized by Operator Gate 7",
        "reference": "publication/register.json; docs/PUBLICATION_REGISTER.md"
      },
      "review": {
        "status": "VALIDATED",
        "reviewer": "Independent Gate 5 corpus-admission agent",
        "reference": "docs/evaluation/GATE_5_SOURCE_REVIEW.md",
        "reviewed_on": "2026-09-17",
        "content_sha256": "ebc8959395335f6f1fb1928b36f7b2c90ef8a27d1f90433b46bc0116fcfa4394",
        "method": "Preserved-original SHA-256 check; fresh PDF extraction plus visual table review, or exact parsed JSONL original-line comparison; field-level transcription."
      }
    },
    {
      "id": "works-row",
      "source_id": "works-southeast",
      "document_sha256": "17f8e177061f36426859f6ed45faefd4af06d077b9d678271baf10d6aade7364",
      "locator": {
        "page": 1,
        "row": "S/N 3"
      },
      "observations": [
        {
          "id": "works.route",
          "kind": "route",
          "raw_value": "Rehabilitation of Olokoro-Ahiaukwu- Itaja-Obuohia- Isicourt- Ikwuano Road in Abia State, Contract No. 6063",
          "value": "Rehabilitation of Olokoro-Ahiaukwu- Itaja-Obuohia- Isicourt- Ikwuano Road in Abia State, Contract No. 6063",
          "currency": null,
          "fiscal_year": null,
          "source_field": "Project Title",
          "normalization": "identity",
          "observation_date": null,
          "missing_date_reason": "The source does not establish an observation date for this field; publication, award and milestone dates have separate meanings."
        },
        {
          "id": "works.contract",
          "kind": "contract_number",
          "raw_value": "6063",
          "value": "6063",
          "currency": null,
          "fiscal_year": null,
          "source_field": "Project Title / Contact No.",
          "normalization": "identity",
          "observation_date": null,
          "missing_date_reason": "The source does not establish an observation date for this field; publication, award and milestone dates have separate meanings."
        },
        {
          "id": "works.location",
          "kind": "location",
          "raw_value": "Abia",
          "value": "Abia",
          "currency": null,
          "fiscal_year": null,
          "source_field": "Project Title / State",
          "normalization": "identity",
          "observation_date": null,
          "missing_date_reason": "The source does not establish an observation date for this field; publication, award and milestone dates have separate meanings."
        },
        {
          "id": "works.agency",
          "kind": "agency",
          "raw_value": "FEDERAL MINISTRY OF POWER, WORKS AND HOUSING (WORKS)",
          "value": "FEDERAL MINISTRY OF POWER, WORKS AND HOUSING (WORKS)",
          "currency": null,
          "fiscal_year": null,
          "source_field": "Report heading / Ministry",
          "normalization": "identity",
          "observation_date": null,